reviewId,userName,score,at,content,thumbsUpCount
ce885e23-4671-4f83-8255-7c56d948c97c,SATRIA,1,2026-03-13 18:42:08,"KALIAN SEGITU BANYAKNYA STAFF DAN PEGAWAI, NELFON KE CS DOANG GADA YG ANGKAT. SISTEM MAU BATALKAN TIKET SAJA DIPERAULIT..INI KENA BADAI SY..MAU AJUKAN RESCHEDULE.. MALAH CS NYA NGILANG , PADA GA NIAT KERJA APA?!!! INI LG FITUR CHAT WA MAKE ROBOT BUAT APAAN, GA GUNA...COSTUMER SERVICE KO KAYA GINI. HERAN...HANGUS TIKET GUA ..GILIRAN KAI YG ADA KENA BENCANA MAEN CANCEL TIKRT PENUMPANG..GILIRAN PENUMPNG MAU CANCEL TIKET DIPERSULIT..KOCAK ??!!",0
2a25722f-14a8-4c71-b434-a67a81037fb3,Matusin,1,2026-03-13 18:40:08,"APK YANG KETIKA PENGGUNANYA RAME ATAU SEDANG WAR DISURUH GANTI GANTIAN PESANNYA (CONECTING TRAIN), GANGGUAN TERUS TAPI GAADA PERUBAHAN DAN PERBAIKAN",0
dbd57e26-40f9-49ae-84ef-12a1dcad9fee,Edi Poerwantoe,5,2026-03-13 18:28:33,good,0
71d7889a-2e69-43ed-8dd1-d3d01a396c07,Wara Hapsari,1,2026-03-13 17:26:03,"aplikasi terjelek sejagad raya, pemilihan pembayaran tidak bisa dilakukan.Tabah lama tambah jelek aja, dulu nggak masalah sekarang ampun dah. Dan pembayaran terlalu cepat kadaluarsanya Masa iya sih harus ke stasiun dulu buat beli tiket... kembali ke jaman batu",0
093f1779-1300-4340-8077-76725501391d,Wahyu Triwibowo,5,2026-03-13 16:52:18,mantab,0
5744ecd8-73a6-4e62-b097-6ce69143a76d,Hafiz S. Hum. S. Psi,1,2026-03-13 15:30:13,tidak upgrade and daftar,0
69c2105c-6a15-44da-b4bc-293bcade74fb,gunawan gunawan,5,2026-03-13 14:52:08,mudah,0
b34dfc76-d7da-449a-8840-bcfc516b4d83,Andri Iryansyah Saputra,2,2026-03-13 14:51:00,"Hp aman, jaringan bagus, tapi Loadingnya kaya maen RDR 2 di ps 3... lama banget parah. menghambat banget ni apk",0
6c2fbadb-9de2-4568-bf00-ab1d01bb0583,Imna Muhtalami,5,2026-03-13 14:50:17,terimksih kai skrg lebih mudah,0
b834e14f-157e-4003-99ec-80453806cd18,NISSAK NUR AINI,5,2026-03-13 14:20:21,Bagus sih mempermudah...cuma kurang dibagian pembayaran terbatas seharusnya diperluas lagi bisa lewat indomaret dll sehingga baik yg tidak mempunyai ATM bisa bayar . 2026 aplikasinya skrmg sering error,3
dcfcf5fa-7b61-4d58-b585-2a2862944440,Mohammad Reski,1,2026-03-13 13:51:42,"sistem error atau gimana? masa udah beli tiket tp ngk ada tiketnya, padahal pembayaran berhasil dan tiketnya ngk ada, masa harus beli 2 kali, yah mudah-mudahan cuma gw yg kena kendala kayak gini, kasihan kalau org lain, Krn harus beli 2 kali",0
2182c1a2-d996-4a66-bb48-7b15c0c549f8,Faqiih Wafaa,5,2026-03-13 13:26:32,josjis,0
528e80b8-35f2-4f1b-99b2-9110ef79435c,Fajar Ahmad,1,2026-03-13 13:10:30,kok gak ada pergantian jadwal ticket padahal sudah di menu ticket mana kalau mau pergantian jadwal di stasiun jauh hadeeh...,0
652a6ef1-6ecd-4408-9d9a-79f15a69a767,Iin Nur Anita Arimbi,5,2026-03-13 12:04:24,sangat memuaskan,0
747ec03d-50a8-41ad-98d2-7e382af08903,zhraarask,1,2026-03-13 11:51:13,"gimana sih ini pembayaran e wallet nge lag banget, tolong dong",0
d00ed3d9-555d-4a5d-8d6f-afea87f440e2,Eva Wardy,5,2026-03-13 11:29:10,sangat memudahkan penumpang,0
af8a7c93-0c70-476b-8869-12f0c5c01cc4,AllYouKnow,1,2026-03-13 11:24:57,"aplikasi rusak! loading screen tidak mau hilang, padahal internet sedang bagus, kalau mau bikin aplikasi anggaran nya dipakai semua tol*l, jangan dikorup!",0
8c213721-787d-4269-ba8e-9d3f9a8ae1f7,Tri Winarsih,5,2026-03-13 10:19:59,sangat mudah dan nyaman.,0
e73f2e45-e285-4a69-a634-90a8826a9df9,Anwar Syah,5,2026-03-13 07:45:06,"lewat acces KAI , pembatalan tiket lebih mudah nga perlu repot ke stasiun, thanks",0
4364b811-68ff-46b8-a68e-e74b55359fd5,ryo ichirou,5,2026-03-13 07:26:00,"memudahkan informasi mengenai jadwal, pengecekan dan serta pembelian tiket KAI. menjadikan lebih efisien waktu",0
8672c23b-a8b2-4ee3-a285-f2a22f6f8fa9,pandu,5,2026-03-13 05:55:35,"untuk Kereta lokal Penataran Surabaya-Blitar via Malang apa tidak bisa di tambahi lagi durasi pemesanan semisal 10 hari kedepan gitu, masa cuma 7 hari lagi keberangkatan di jam 06.00 tiket sudah habis semua",1
99f39ffd-9a83-4100-999d-3f10f8777885,Julian Rahmat,1,2026-03-13 05:53:15,bisa gak kalau apel yang seragam hijau di stasiun serpong itu tidak menghalangi akses ke tempat parkir motor? macem yang punya wilayah. MENGHALANGI JALAN YANG LAIN.,0
7a97ddad-7fd2-4176-91f8-4f7239675a33,Lasmi Sarnobudi,5,2026-03-13 04:46:44,sangat bagus 👍,0
6c4326fe-8719-468a-b3c4-92df4c4d9230,Candra 12,3,2026-03-13 04:06:16,"kenapa ya terkadang saat cek tiket masih ada keberangkatan di beberapa hari, lalu refresh tiba² tertulis jadwal keberangkatan tidak tersedia di semua waktu yang ada",0
5da61a64-7dd0-4b1a-8c6b-bd7ccf1ed1d8,MUCH. ALDI FIRMANSYAH,1,2026-03-13 03:48:46,"makin jelek, dulu bagus",0
39a959e9-2a03-416f-99c7-57a87917b691,Agung Priantama,2,2026-03-13 01:00:22,"kirain pas nyambungin akun e wallet kesini bisa buat bayar tiket kereta, ga tau nya ga bisa sama sekali",0
d22da98e-b169-4c22-bce9-f16c4db5457a,Lennin Putri,1,2026-03-13 00:20:46,pelayanan ramah doang ga membantu,2
2311df95-a1d5-45c6-8d9f-aa21fdd9f7d4,Rey Kyrksen,1,2026-03-13 00:15:36,sistem menjadi sangat jelek ketika dibutuhkan,0
566c2fc6-6abc-4100-b8af-582e351b5933,MHAR,1,2026-03-13 00:11:43,Waduh gak bisa pesan tiket gara-gara keluar dari pembelian. pas mau masuk gak bisa batalin . Ini gimana IT nya?,0
8849a695-6bb2-4e6a-99c9-ebc0ab7b9ab3,Zea Arsy,5,2026-03-13 00:10:37,ok,0
f1c8ae12-ec06-46d4-a6fe-fc73cc855215,Muhammad Yunus,4,2026-03-13 00:03:52,praktis dan bisa pesan 6h sebelum keberangkatan.,0
913c07db-0463-41f0-beac-81f1767545e2,Betty Puspitasari,1,2026-03-12 23:27:09,"saya membeli tiket prameks melalui kai acces dan membayar lewat qris bca dan gopay,, semua sudah berhasil namun kenapa tiket sya tidak berhasil melalukan pembayaran dan hangus ,jadi sudah kepotong biaya 3x gak ada 1 pun tiket yg berhasil .",0
164c8d07-6313-4a25-8ec5-d600fe176b09,Hery Setyawan,5,2026-03-12 21:01:27,bagus cepat,0
554cf4b2-4d7c-4123-a247-5a8498d0a755,Aji Khun,5,2026-03-12 20:48:40,terimakasih,0
3758ed0a-6765-4e65-a41c-0133e2403ffd,Fakhrudin Panel,5,2026-03-12 20:38:04,perjalanan semakin nyaman dg KAI,0
448f9320-aa10-4435-819c-ba4dadb9f18b,Arga Avrilia Putri,5,2026-03-12 20:09:11,"baikk cepat, simpel",0
071008e0-c418-42fc-a738-b12b82e7b95e,ariya yonda,1,2026-03-12 19:50:22,"ini kenapa untuk payment ngga bisa, banyak opsi payment tp eror semua",0
6372b590-496f-4a10-80a8-86db99ddf3e7,Setiawan Herdiana,5,2026-03-12 19:18:56,Semoga gak gangguan saat Boarding di Stasiun,0
1aeb5243-c93d-4ffa-90a0-c7a8ad7b8a9f,Laonny Galuh V,2,2026-03-12 19:08:03,"kak tolong ini gak ada jadwal tiket lokal ke kertosono. gimana ini,sebentar lagi pan libur lebaran. kok malah ngelek gini?",0
b8aaf532-5918-46d8-8e4d-d4d79a84e74a,achmad oi,2,2026-03-12 18:42:25,"mahal amat biaya adminya top up 50k masuk 47,500,mending bayar lewat qris dari pada top up🤣🤣🤣",0
f1d79be0-f9df-413a-87ab-f7cc96957743,Mochammad Safirin,5,2026-03-12 17:46:47,saya suka amplikasi ini,0
10752385-3fb9-419f-87a7-5af676e9d212,Fary Aditya,5,2026-03-12 17:44:04,bagus banget,0
bda8fe8c-c98d-49dc-b3cc-dfece90f6813,Mas Darno,5,2026-03-12 17:22:07,"Perjalanan menyenangkan dan Aman, krn sdh didukung lingkungan yg bersiĥ, teratur dan nyaman.",0
26d6617c-1373-439f-85ba-d3a1b7513a2a,Ghifar,1,2026-03-12 15:46:56,"saya udah pesen tiket buat mudik. sekarang saya mau pesen lagi tiket buat baliknya tapi loading Mulu connect, padahal sinyal bagus tolong benerin. mau lebaran apk malah eror gajelas benerin pada niat kerja ga?. kalo tiket abis yang kasih tau tiket abis ini malah kadang muncul jadwal keretanya trus beberapa menit kemudian ilang lagi connect",0
a6e5d524-f43e-4607-9997-c28802da61bb,roy hardiansyah,5,2026-03-12 15:34:06,baik,0
407bb757-f04b-49e5-91e4-05d7ccd382ce,Sofiatul Mubarokah,1,2026-03-12 14:25:28,makin sini makin aneh nih apk. masa mau beli tiket gak muncul terus,0
d274f221-9e84-458d-b22c-7027577d4d39,Imam Riyana,5,2026-03-12 14:00:23,mqntap,0
78ed69eb-af09-46bc-890d-cd08a7655b56,Darwati Susilastuti,5,2026-03-12 13:38:28,oke,0
1891ef74-6808-4353-ade0-94c38d0a21ff,Kanaya;3,2,2026-03-12 12:06:06,"Aturan pembatalan yang mewajibkan rekening harus atas nama penumpang itu menyulitkan. Banyak tiket dibeli orang tua atau kerabat, apalagi kalau penumpangnya masih anak dan belum punya rekening. Mohon dipertimbangkan agar pengembalian bisa ke rekening pembeli tiket, bukan hanya atas nama penumpang. Terima kasih.",0
0939b3f5-2932-4c7c-91e1-c5b7d0731153,Nur Afina Julia Larasati,2,2026-03-12 11:53:02,sistem lambat sering eror,0
b40ed89f-7608-462c-8e5c-dae0c3fd879f,Abu Yusuf Ismail,5,2026-03-12 11:46:35,"Terimakasih KAI yg telah membuat aplikasi ini sehingga pecinta kereta api terbantu untuk melakukan perjalanan bersama KAI tanpa terkena biaya aplikasi Travelling lain,seperti Traveloka dll",0
fb08d583-9b8a-4b4a-90e7-c62375c13d35,Muhammad Furqon,5,2026-03-12 11:42:53,aplikasi gila. aplikasi Indonesia kok Bontang diatas 4. gila ini kai Indonesia. jayajayajayajaya.,0
0d842ea8-dd75-440f-a654-08280622a279,Rizky Ananta,5,2026-03-12 11:42:47,baik dan respon cepat,0
98e7ff2d-1c4a-40cf-86aa-619972895647,TAUFIK MAULANA,5,2026-03-12 10:48:27,bagus,0
03f78bda-e6ea-45df-b4ef-366c9a29da42,Abdullah Rozie,5,2026-03-12 10:08:46,simple & friendly service for ticket reservation,0
f10a90c7-dfe3-4cdf-b3d5-752764ab8a72,Supri Yanto,5,2026-03-12 09:53:15,"Ribed sih, tapibia demi ke rapihan dan disiplin.",0
2bfcc57b-5c5d-42d2-8b47-f4f6502c2417,KAVALERI 12,5,2026-03-12 09:12:52,tolong dong buka lagi tiketnya,0
74e689df-e1de-407e-9036-8d63796fb635,octa pilaa,5,2026-03-12 09:09:23,baik,0
065f6d00-cc7e-4cb7-b32e-b7f52668a327,Muhamad eko Iman santoso,5,2026-03-12 08:55:36,ok baik,0
e90a35cf-73e9-4806-95a0-6d84e5dbcbec,M Taufiq Juhandi,4,2026-03-12 08:50:30,ok versi terbaru bisa menggunakan qris dalam metode pembayaran. tapi ketika memesan dan qris tersebut tidak sempat di scan di dompet digital tetapi aplikasi kai mya terclose kita ga tau dimana mengakses qris sebelumnya kembali untuk di bayar. walaupun ada di menu menunggu pembayaran pesanan kita tetapi untuk qris nya entah dimana,1
622f8c8c-6cca-475e-b338-28e617ca0a39,Den Bagus,5,2026-03-12 08:48:10,Praktis dan cepat,0
a7a2649d-7c54-415e-ba91-18c75d57b8e5,Oe Tjik,5,2026-03-12 08:30:26,cepat dna praktis,0
a80ada0d-fdf1-42d8-a5ef-0c78076b3b2c,Yuli Yulianti,1,2026-03-12 08:12:15,"kecewa banget sama ini aplikasi, saya klik tanggal pemesanan dengan benar tp tercetak tanggal yg salah.maju seminggu. resqedule kena admin,batalin kena admin.yang rugi konsumen. padahal yg salah sistem aplikasi mu yg error. ga ada solusi banget !",0
a7b7e32e-8637-473e-a909-b29d0c8c6fe5,arifin budi,1,2026-03-12 07:39:32,buruk. pembatalan tiket ribet sekali jika kita membelikan tiket untuk org lain,0
a49e65a7-d589-439f-9951-3de0a55e1a24,rahmi asti,1,2026-03-12 07:13:53,aplikasi menyebalkan beli tiket buat anak NIK nya ngk bisa dimasukkin,0
a42b9541-67cf-4ee2-98fa-83e10eabdd2f,Didi Setiawan,5,2026-03-12 07:02:01,mantap,0
f29ab9b1-50ab-4916-81a1-a3e073f1a983,Mutazar Tazar,5,2026-03-12 06:09:52,bagus,0
59e0016a-5e82-4333-a7e6-fe07451c66cf,Ahmad mukti Aji,5,2026-03-12 05:50:41,baguss,0
16d8f51c-1b79-47eb-bf93-2a13abf955ce,Puji Astuti,5,2026-03-12 05:14:33,pelayanan via online nya cepat dan mudah,0
fb7dd89a-1743-4880-9801-2f1e97187662,Saefuddin Jailani,4,2026-03-12 05:08:53,sangat membantu,0
34740c81-6137-4b45-9c06-bc853ce9e572,Adzra bloger,5,2026-03-12 05:01:08,ok,0
8c84c0b2-95c0-4cef-b3f3-65cdda46afd9,helmy ilhamsyah,5,2026-03-12 03:43:31,mantap,0
806fae33-2b82-45b0-a94b-0a8cddff3fca,Boedi Asijanto,5,2026-03-12 02:40:04,sangat bagus untuk pemesanan tiket,0
b2028b3e-1d4c-4630-bf35-9f69e4f0cdd9,Irul,1,2026-03-12 01:56:41,apalah tiket sudah di batalkan tetap masih suruh bayar,0
3046f502-ddf1-4eef-857a-4e9f89e8f4d4,Rama Gaming,1,2026-03-12 01:21:55,gak jelas ini aplikasi mau war tiket udah tinggal pilih kursi mlh ditolak Mulu giliran keluar tiketnya habis,0
3019900c-60d0-490a-9548-7017ac79d03d,Coral Zero,1,2026-03-12 00:58:46,Lebih jelek dan lebih lambat untuk sistem pembelian tiket daripada sistem lama,0
ecc8ce44-49b8-453d-8358-59647534c6a9,Humairah Azzahra,2,2026-03-12 00:48:19,"setiap pemesanan padahal saya saya sampe rela nunggu in tengah malam udah saya klik di waktu itu juga kenapa sering ada tulisan ""no Seat available"" kita butuh darurat jdi mohon bantuannya jangan di persulit",0
1904f47c-f7e2-4317-acc3-d6b16b7df7f1,Anton Yusuf,1,2026-03-12 00:43:24,Aplikasi sering ngelag sampai kehabisan tiket..di belain jam 00.00 gak tidur..malah zonk.,0
f93d4ea4-aa81-4d6b-bcaa-41ff5dc4f79d,Siti Fatonah,1,2026-03-12 00:41:41,"banyak updatenya, lalu jika suda di update datanya hilang. waktu di masukin lagi gabisa katanya udah terdaftar. ga jelas",0
f4341cfa-8ad5-4c2b-a9fe-22a01be89190,Fitraldi agung pratama,1,2026-03-12 00:36:31,"GABISA PESEN, PAS UDH PESEN GABISA DIBATALIN ALASANNYA TRANSACTION NOT FOUND, APK GAJELAS, TULISANNYA BEWARE APP RISK",0
ce63c595-9b07-44a4-bc53-0f5a78cf7ced,Imam Malwopati,1,2026-03-12 00:35:34,aplikasi jam segini pesen tiket sudah habis gak masuk akal,0
4af44cc6-d6ce-4312-b932-287d23622444,Satrio Zachry,1,2026-03-12 00:29:44,"apk macam apa ini, di jadwal tiket kursi tersedia, waktu mau pesan dan sudah isi daftar penumpang malah tidak bisa, makin di perbarui bukannya main bagus malah makin jelek!!",0
5fe1c7ff-6e82-4593-9844-c744d95d0159,fina dork,1,2026-03-12 00:28:40,error terus. Sudah di bayar tiket gak ada. mau pesan lagi tulisannya tidak bisa karena data sama dan double tiket. Aneh,0
bd30cbf1-8e6a-4b74-9127-0dcc7e0c9f79,Arif Setiawan,1,2026-03-12 00:17:48,bukan nya di permudah malah di bikin sulit mesen online ini. mending sekali klik bisa. ini coba lagi coba lagi. tapi klo aku sendiri yg mesen bisa . pada hal saya mau mesen in nama ortu . malah gk bisa. tapi klo nama sendiri bisa.,0
72bf4340-b905-44ae-a535-e01f58077156,ariya valentino diaz,1,2026-03-12 00:17:36,"sering error,tidak bisa pilih kursi",0
6b4a4c58-394e-4f9b-ace9-2c50f49fe229,Naufal Ariq Purnama,5,2026-03-12 00:01:19,mantapp,0
44d78514-794b-40b5-b51a-16b1a7a82cd2,Tri Tanti sayudi,1,2026-03-11 23:31:37,hala habis teruss pesen gak bisa kuntull gak bisa mudik parah ni apk bikin gemesss ada calo kuntul mkany habis teruss parahhhhhhhhhhh,0
0e9e65cb-5c0e-40c1-bd39-e48a081a7085,Kang Yakin,1,2026-03-11 22:38:08,satu dulu,0
bd9f3e0c-067e-4b9c-9dbb-c9576e2287cd,Yayan Jaya,5,2026-03-11 22:09:24,ok,0
2fd428b6-7471-4556-96c2-d264a7b0a6c7,Diky,5,2026-03-11 20:53:23,bgus,0
29a34be4-67ff-47d2-9457-969b7c4f141f,Farhan,1,2026-03-11 20:35:01,"estimasi waktu gak sesuai , wajar lah orang subsidi",0
95f0e947-9852-419c-a259-27153b034d3e,Ujang Emin,5,2026-03-11 20:03:13,setia dg kai,0
ac0906c3-e17b-4b0d-bede-c6b03d6ef15e,Rusnita,5,2026-03-11 19:59:21,sangat Membantu sekali,0
2f7aea05-6cbd-4077-bd09-bd522801da16,islahuddin anshory,5,2026-03-11 19:56:19,bagus sekali,0
3941ecdd-b77b-447e-9721-654647806819,TamTama_9213,4,2026-03-11 19:26:09,servernya Tolonk di perbaiki :3,0
6b1b301f-a7b1-4a18-9e74-b3f52b3d2dc3,Ugih Nuriyana,1,2026-03-11 19:11:15,"Bikin sinyal ilang2an setiap kereta lewat, Ganggu aja",0
d010b137-3c7e-4d06-aa9f-a5caeec47fb9,b vristn,2,2026-03-11 17:35:23,"aplikasi sering down, dan ga bisa cancel tiket",0
f7032368-746f-41bc-a3e5-5bc032bce83a,Wawan Mulyawan,5,2026-03-11 17:16:56,perjalanan lbh mudah dan efisien.,0
aeafe7e3-378e-457e-962b-3b7d05b9ab63,Erwinsyah Pasaribu,2,2026-03-11 16:51:46,semua jadwal kosong kocak ni apk,0
411bf5a7-a74a-457c-a510-1087f389729f,D Han,3,2026-03-11 16:41:54,"suka error kalo lagi mau pesan makan lewat aplikasi waktu dikereta, padahal sinyalnya bagus.....tolong perbaiki lagi",0
988d7168-0b9b-4867-ab42-6c4c5e307c07,Andi Suhandi,5,2026-03-11 16:12:18,ok,0
b9cf64fd-df02-4e06-8d20-67630ae2b9d5,Didik,5,2026-03-11 16:12:00,sangat memuaskan,0
b12061c0-c46f-46f3-bf3d-6a4bd9609207,Ery Ekklesia,5,2026-03-11 15:44:16,Tingkatkan!,0
a04d1e92-d876-4f8a-80bb-9889cb3ab51b,Marica Triyaningsih,5,2026-03-11 15:42:27,Tingkatkan!!,0
15cd6cbe-298e-4af7-b3e0-3c3ac1384211,Syam,1,2026-03-11 14:46:44,hari ini tgl 11 Maret 2026 kereta tujuan Tangerang dari duri jadwalnya ngaret sudah tunggu dari 14.20 jam 14.45 kereta masih di tanah tinggi sampe duri bisa jam 3 lewat apaa apaan ini jadwalnya ngaret parah,0
4c63123c-c69e-4367-ace8-b9b9c3316b14,Desniati Desniati,5,2026-03-11 14:39:08,Terimakasih,0
4a034456-c524-4101-8904-1b1b18070065,Rifqi setiansyah,1,2026-03-11 14:34:09,"gabisa refund langsung di apk, sedangkan langsung datang ke tempatnya ada kendala padam listrik lama sekali posisi tempat (st.pasar senin) tgl 11.03.2026 jam 14.25",0
01be0473-d1f9-4485-9753-9aef40acccdb,Surya Perdana,5,2026-03-11 13:23:45,mantab n cepat,0
5fd53170-9d06-444b-bb42-cf6a0493a27d,yudis tira,1,2026-03-11 13:04:22,"aplikasi gak guna, liat ketersedian tiket eror2 terus gak muncul, sekelas perusahaan bumn yg gak punya saingan aja gak bisa bikin aplikasi yang bener2 worth it.",0
9534e81e-d94d-42d8-b150-89dad2282acd,rosa iliyah,5,2026-03-11 12:53:59,oke,0
1787757e-10e2-489b-848c-a4db958fcaef,guitaronly,1,2026-03-11 12:35:38,makin ribet banyak error'nya padahal sinyal sudah sangat bagus,0
81b7febe-b50d-47bf-9741-cbc24eea6630,Assyifa syifa,5,2026-03-11 12:26:59,good,0
aa805dbe-cbe6-426b-8b5e-a1bc4e205480,Rayhan Ashter,1,2026-03-11 12:14:04,"pengenaan antrian tidak logis, sering sekali apk eror dan tiket yang tersedia tiba² tidak bisa di beli. ini sangat merugikan konsumen. kedepan nya mohon di perbaiki kepastian ketersediaan tiket dan sistem aplikasi nya agar tidak sering eror.",1
04b60615-eca4-4c35-be0d-f285c1e98527,Rahman Dika Putra,3,2026-03-11 11:59:35,bagus tapi selalu eror ga bisa pesen tiketny,0
c11d8fff-76d5-43cd-9024-968f30d90d0c,Sisri Wahyuni,2,2026-03-11 11:54:16,sering eror trs bayar pakai e Wallet juga sering gak bisa,0
3548a91b-fcfa-42f2-88cf-09f6eb6e3597,zaki almalik,1,2026-03-11 11:23:16,belakangan ini aplikasinya sering eror tidak bisa membuka kereta lokal hanya loading saja,0
176d9dd1-a85a-4354-a367-40034bb23cce,Sahroni Roni,3,2026-03-11 11:06:38,"Aplikasi nya kebanyakan trouble!! Tolong diperbaiki dong masa iya trouble mulu dari dulu kaga pernah bener, Ada aja gangguan nya.",0
b049f9dc-18cf-4698-94cf-179e0f64208e,Fiqri Fatur Rahman,5,2026-03-11 11:02:33,bagus sekali mempermudah konsumen dan mudah digunakan,0
04d9fa90-ecbd-4d2e-a1ac-290b6baf5fdb,Roosevelet IV,1,2026-03-11 11:01:19,"aplikasi aneh telat bayar dikit malah jadi gabisa apa coba pas mau di batalin transaksi tidak ditemukan ,mau di transaksi malah gagal apa coba gini aja trus ga pernah bener kalo ada bintang 0 dikasih 0 nih aplikasi 👎👎👎👎",0
1b5f6b21-04c6-406c-a993-a5db793b2a16,Seinsey Jr,1,2026-03-11 10:57:08,"Aplikasi dengan pengoperasian yang lamban padahal jaringan kuota dan wifi kagak lemot, lah ini aplikasinya lemot sendiri darisananya",0
e0b8f645-5555-4b9b-9f7e-9c36e31132e5,Angga Murdani,5,2026-03-11 10:51:43,mantap,0
2043a91d-ad05-4994-a192-aa6aca466893,Fersy Kies,1,2026-03-11 10:51:41,"berat banget ui nya iklannya apalagi, mikirin lah setiap hp ada gen lama sama baru optimal gak, udah bayar eror lah inilah gak jelas lu",0
0a9a790d-3dcf-4aaa-9c9c-951aed35bfbb,Maulidany,2,2026-03-11 10:44:12,"BUG MULU, !!! gak bisa pesen tiket",0
f6e80f3f-7d41-4713-86dc-486c89b93931,Fauzan Khalil Ridwan,3,2026-03-11 10:29:10,"ini kenapa, jaringan saya bagus tapi pas liat pencarian jadwal muter nya lama banget, trus giliran udah masuk di metode pembayaran nya yang justru lebih lama? atasi dong KAI kenapa",1
3ff8ae4b-e719-444f-89a7-973684824c12,Kristin Kristin,3,2026-03-11 10:18:30,berat banget ui nya lag banget di HP gue,0
6b60e11c-0834-4928-85a2-48750f907405,Defirika Ramdani,5,2026-03-11 10:11:56,dengan online memudahkan pemesanan tiketnya,0
5393562a-d16a-4722-9e6b-0d54a0b791b5,Mila Restu,1,2026-03-11 09:40:58,"gk bisa di dowload lagi acces by kai nya, kata nya perangkat ku gk kompatibel versi terbaru trus gue harus beli ip gitu min biar bisa beli tiket kai",0
b040b9d5-8e05-4f84-a596-9684908e2ca6,Yunita Dwi Lestari,1,2026-03-11 09:07:27,"tolong dong pihak kai atur gimana baiknya, masa saya baru batalin tiket tp dicek HP satunya lagi selang beberapa detik udah zonk itu tiket yang tadi sy batalin, ke endap/ditahan dimana lagi tu tiket? masa iya kalah sama calo sdngkan calo tiket saja sistemnya ngewar sama aja dan satu lagi saya mau pesan tiket tp tiket tidak tersedia semua bahkan di klik tiket yg sudah habis pun tidak muncul?? kemarin adain war diskon tp gada tiket yang dijual parah sii makin kesini makin"" ni apk",0
21a937e6-bff0-47ac-9b24-020c9094844f,Firmansyah Hidayat,5,2026-03-11 08:55:36,"Access byk KAI, PROFESIONAL MANTAB LUAR BIASA. Pertahankan Pelayanan Terbaik",0
8856203e-1d4e-4122-a52c-f3d4b7b44938,Eka Febri Pratama_,2,2026-03-11 08:03:03,"Mau pesen tiket malah kena bug terus, muncul ""jadwal kereta tidak di temukan"" di semua tanggal jadi bingung mau gimana 😮‍💨",0
351ef367-013b-4171-a46b-44b06de695ca,Ai Fatimah,5,2026-03-11 05:28:15,lebih mudah booking tiket,0
2af80cbe-afaa-4811-a99d-6bfbac27a0cb,Aby Respaty,1,2026-03-11 05:13:04,lemot banget dech aplikasi nya,0
15c89748-0199-46e5-95ae-5e7cd06786e1,Dewi.lisnawati Wie,1,2026-03-11 04:56:00,kenapa saya tidak bisa mendownload aplikasi ini,0
adf48e49-d61b-4ff6-92ca-8009f97d3e2e,Gana M,5,2026-03-11 04:36:26,bagus,0
fe0cfb34-faab-4da7-8232-e32825d77b80,Akhji Mullah,1,2026-03-11 03:05:20,tolong developer masak mau update jadi member acses selalu stuck terus apk nya sampe panas hp udah diulang berapa kali tetep sama udah sampe kirim otp loh gitu terus ios padahal,0
aa4c0be5-7098-48e9-8100-ec6fa1809bc9,Yatnopeking Purworejo,1,2026-03-11 02:58:44,kenapa tahun 2026 Susah cari tiket selalu habis tiap tgl tiap hari habis,0
81a779dd-ddc6-4239-a7c2-1131079e814a,Ahmad aris syaefudin,2,2026-03-11 00:29:23,"aplikasi pemerintah, tapi kurang handal, seiring lag",0
87557599-411e-48cc-9dac-94a8e7c1f477,Derry Saputra Emilga,1,2026-03-11 00:16:51,"dua malam begadang demi tiket mudik TNK - BTA tp server ga bisa akomodir, malah langsung habis karena Penumpang yang ambil rute TNK - Kotabumi. tolong diperbaiki KUALA STABAS untuk semua PENUMPANG SEMUA RUTE, bukan hanya Untuk Rute TANJUNG KARANG - KOTABUMI SAJA, Sistem Bobrok !",0
0882ecd4-7df7-4f72-b4a6-36f22491dbee,agus santoso,1,2026-03-11 00:15:33,"di aplikasi habis, beli di calo ready. kocak kk",0
879e43d6-3c55-45df-93f4-ac41fed05a9d,Anjas Novita,5,2026-03-10 22:07:40,Good app,0
a67f28ab-c3ac-4b9a-a4d7-ff64ba22ef9b,Y H,5,2026-03-10 20:59:35,cepat dan mudah,0
dc9c24d9-4780-4efb-a360-141c49230839,Farhan Aulia Kamal,5,2026-03-10 19:41:02,dari sekian banyak BUMN. KAI doang yang bagus. BUMN yang lainnya buat APK kaya sampah,0
33263bc6-3976-46ca-a014-1bc06c511fb9,Farras Mufid,1,2026-03-10 19:33:55,"sever error terus, sekelas KAI apk nya sangat sangat jelek tidak dapat memesan tiket server sering down",0
bf93b2c9-c352-40b8-9233-903b2f39ba80,Hamka Ridwan,5,2026-03-10 19:25:10,ok,0
33b147f1-0097-4b37-9c9a-5d5d968771e6,Danang Widarto,1,2026-03-10 19:01:54,Lemot payah gak jelas..!!! sering eror gak jelas,0
75a033b8-ba32-44fd-a2cc-3ccc2130481f,khusnul kawakib,5,2026-03-10 18:41:50,praktis,0
c45bff09-6b5a-482a-9929-a0dda01eb062,Yudani Hermawan,5,2026-03-10 18:19:26,sukses selalu KAI,0
50c6ecf3-0945-492e-b753-60f697c7f55c,rafif karis,1,2026-03-10 17:38:00,RUWET,0
cf8c61dd-efb3-4044-b349-391974043c6b,Ricat Victori,1,2026-03-10 17:28:04,aplikasi gajelas kebanyakan error. masa setiap mau bayar gagal terus pending lama nunggu and pasti keluar halaman. DEVELOPER LU GANTII. BANYAK BUZZER BINTANG 5 MAKANYA GA BERBENAH,1
5aecb077-b571-463d-b885-355ed26834ed,Ali Muhtar,5,2026-03-10 16:29:05,semakin ok,0
83b505ab-7bdc-45c1-b301-c595bf772960,val val,5,2026-03-10 16:20:35,jos,0
98631aad-c06a-4576-be12-3fb4145aec12,Budi Santoso,4,2026-03-10 14:55:09,aplikasi udah bagus....tapi waktu cari tiket bila kelamaan......... jadwal nya tidak akan tersedia....normal lagi kisaran 20 menitan,0
c12554c5-08db-4f21-8190-9b1ee96ed9f3,Bocah 1999,5,2026-03-10 14:40:38,mudah😎,0
5faced9b-d697-4cc4-9a58-99ca029f78bf,Muhammad Falihuddin,2,2026-03-10 14:17:21,sulit sekali melakukan pembayaran!!!!!!!,0
67d6437e-4e29-4a4b-a35f-0316e50ef5be,Edy Susanto,5,2026-03-10 14:12:27,sangat membantu pelayanan transportasi keluarga saya,0
924e0cb6-78da-4e00-8cd3-e5d3daf597d1,Abdul Muhyi Rofii,1,2026-03-10 13:49:22,APLIKASI BIKIN BEBAN !!!! MAU CANCEL AJA HARUS KIRIM OTP EMAIL DAN NO HP.. PARAH MAKAN UANG HARAM HAK PENUMPANG KAI.!!!,0
7c95b9a3-3aa4-44cb-8f94-034f82f65e19,Bintang Valentino,1,2026-03-10 13:32:22,top-up udah 2 hari masih blm ada masuk masuk gimana ini,0
ee14af0b-9657-4397-8b8e-875f1eb56c9f,Ranu Official,1,2026-03-10 13:02:58,"saya naik kereta Cikuray dr cikampek ke jatinegara no kursi deket jendela, tapi yg dudukin orang lain, tolong pak di informasikan lagi ancam orang yg ga sesuai tempat duduknya. himbauan berlaku untuk seluruh penumpang ya, bukan orang-orang tertentu doang. (kecuali kereta lokal bebas tempat duduk)",0
055967da-9906-4413-86dc-afb4a802f566,Dadan Handani,5,2026-03-10 13:01:41,terima kasih,0
7a7c8183-93ac-43c0-aa74-abac4ceb4c46,Auliya Rahmanto,5,2026-03-10 12:42:16,mantap,0
e05f1f11-8081-4778-80de-4266c510afb2,Alim Lim,1,2026-03-10 12:37:01,"tolong kai d perbaiki lagi aplikasi nya , cek d aplikasi kai jadwal kereta kosong semua per tgl nya , giliran cek di traveloka jadwal muncul ,, gimana ini ,",0
afcb7cc1-81e5-4d6a-b192-f840d086fa2d,Erwin Ragil Pamungkas,1,2026-03-10 12:36:22,aplikasinya kaya sampah,0
d99fa22a-f31b-4fd9-8fb0-20b6026f4789,Adlan Ghafar,3,2026-03-10 12:27:55,"halo.. membatalkan booking ditengah proses, masuk dalam kategori booking kah? karena dapat notif batas booking 6x padahal belum capai angka segitu untuk yang sudah saya booking. Bug atau memang begitu?",0
f230f410-b8e7-413d-92cd-4c5e7a61e2e7,AKUBENCIREDMI REDMIASU,1,2026-03-10 12:22:58,"apalah aplikasi GK jelas padahal metode pembayaran nya banyak tapi pada GK bisa dan juga saya sudah melakukan semua langkah nya tapi percuma semua, memang tll",0
e9a8830f-be0c-4e67-9965-b918d9cbf84f,Muji Atiq,5,2026-03-10 11:19:46,makin gampang beli tiket kereta tanpa harus ke stasiun,0
